Subreddit,Post Title,Post Score,Comment,Comment Author,Comment Score,Created,Keyword,Sentiment,Parent Author
democrats,"“We must face the reality. We must use the real words. After Saturday’s rally, the modified Sieg Heil, the music, the QAnon madness … Trump IS America’s Hitler,”",1477,"*“We must face the reality. We must usethe real words. After Saturday’s rally, the modified Sieg Heil, themusic, the QAnon madness …* ***Trump IS America’s Hitler,****”*

(Keith Olbermann)

[https://www.theguardian.com/us-news/2022/sep/19/trump-qanon-song-rally-video-ohio-vance](https://www.theguardian.com/us-news/2022/sep/19/trump-qanon-song-rally-video-ohio-vance)

&#x200B;

I would argue he's worse! Atleast Hitler was a soldier and a painter and lived in a failed economy with genuine poverty , persecution and lack of anything post ww1.  

The German people were suffering which lead them to extremes. Hitler took advantage of that and  atleast on some level believed he was making a better Germany.  

BUT I cannot say I believe Trump wants a better America.   Trump the draft dodger whose not a starving artist but a billionaire!  And America is one of the riches nations on earth!  

So Hitler was about as bad as you can be but Trump is somehow so much worse as he has no excuse.  But like Hitler, Trump will fail! Two losers together in hell.

**Edit:** *I'll add to this Fox news is clearly Trump's propaganda arm (or was) and all too similar to Hitler's radio division. And I guess that would make Tucker Carlson a modern day Goebbels?*",ilivedownyourroad,20,2022-09-19 18:36:21,QAnon,-0.03639705882352941,ilivedownyourroad
democrats,"“We must face the reality. We must use the real words. After Saturday’s rally, the modified Sieg Heil, the music, the QAnon madness … Trump IS America’s Hitler,”",1477,"For the first time in known history trump played the Qanon anthem at his rally which resulted in this Q salute.  **Think about that**.

They went silent and prayed to trump and saluted Q as trump played the anthem..and said he was one of them etc.",ilivedownyourroad,4,2022-09-19 18:36:21,QAnon,0.125,Bedivere17
democrats,"“We must face the reality. We must use the real words. After Saturday’s rally, the modified Sieg Heil, the music, the QAnon madness … Trump IS America’s Hitler,”",1477,"I see. Thats scary.

Didnt know there was a qanon anthem tho.",Bedivere17,1,2022-09-19 18:36:21,QAnon,-0.5,ilivedownyourroad
democrats,"“We must face the reality. We must use the real words. After Saturday’s rally, the modified Sieg Heil, the music, the QAnon madness … Trump IS America’s Hitler,”",1477,"Important to say what we don't want to say aloud. 

Trump is America's Hitler. He's not hilter. He's maybe not as bad (yet) but with covids 6.5 million deaths on his watch and Qanon and the insurrection. At what point do we accept the facts infront of our eyes.

We can play semantics over whose ""more"" evil but the fact that we are even doing that...is a huge problem when discussing a former and future potential President (and current party leader) in this context",ilivedownyourroad,1,2022-09-19 18:36:21,QAnon,-0.04444444444444442,Hero_of_Parnast
democrats,This is so hard to watch. ,2077,It is QAnon garbage.,Gutmach1960,58,2024-09-10 21:27:18,QAnon,0.0,Creative_Knowledge75
democrats,This is so hard to watch. ,2077,"I think she’ll win, maybe by a lot, but Trump, SCOTUS, Russian and other influences won’t stop there as we know so the aftermath after the votes are counted is where all the drama (again, sigh) will be.  He’s already setting the stage for it and election fraud and blah blah blah - we’ve seen this all before but this administration will handle it much better and be prepared.",ParadiddlediddleSaaS,27,2024-09-10 21:27:18,QAnon,0.29375,nolongerbanned99
democrats,Former US Attorney Jessica Aber found dead in Virginia at 43,1657,"Do NOT spread fear-mongering conspiracy BS. She had a medical condition, it was not an assassination. Let’s not be QAnoners.",Hero-Firefighter-24,1,2025-03-22 21:25:14,QAnon,0.0,Infamous-Echo-3949
democrats,Newly Freed ‘QAnon Shaman’ Is Already Back on His Bullsh*t,350,">In his first post back, Chansley uploaded a computer-generated image of himself howling in the back of a police car—while wearing his namesake headdress and red, white and blue face paint. The caption was just one word: “FREEDOM!!!”

...aw, c'mon, Uebelacker: you can't begrudge the guy that one.

**EDIT:**

>“I have no animosity or hatred towards the United States federal government,” Chansley said. “And I have forgiven my captors, and I pray for them.”...

>But the latter, darker half of Chansley’s video contained several veiled references to his continuing quest for “the truth”—and an ongoing fight against “global corruption” that echoes the language of conspiracy theories like QAnon...

>Chansley didn’t mention Donald Trump, Jan. 6, or the 2020 election directly in the video, but he touched on “obvious” signs of international corruption.

C'mon, Erik—what'd you expect?  Do we have to hold a grudge with guys like him until they stop getting taken in by dumb conspiracy theories?  Bc I'm not sure I have that much energy.",capsaicinintheeyes,1,2023-05-27 00:23:40,QAnon,-0.015104166666666665,Free_Swimming
democrats,"RFK Jr. says Deep State ‘is real,’ called FDA employees ‘sock puppet’ of industry",78,"Q from QAnon said the Deep State was a cabal of pedos who existed for one reason and one reason only--to destroy Trump.  MAGA believes the Deep State is everyone who is not them.  Trump believes the Deep State is everyone who is not him and his immediate family. For a couple of decades the Heritage Foundation believed the Deep State are the unelected bureaucrats.

How come none of these people ever think that maybe they are the Deep State?

As an aside, going back a few decades, the far-left believed the Deep State was the corporations that really controlled government, or the Illuminati, One World Order, etc.  At least the far-left's concept was more believable.

There is some truth to RFK, Jr's comments here --business has been in the habit of wrapping itself around what-ever Fed Agency or Office it has direct ties to.  Kinda funny, though, considering who Trump currently has in his Administration.  I guess it is not the Deep State when it is out in the open?

Also, when RFK, Jr. was a kid, practically no-one was diagnosed with autism.  Back then, they just got labeled a problem child and sent off to boarding school, disciplined, etc. There is some talk these days about why so many children are now being diagnosed with some attributing it to better diagnostic tools and others saying that it is too easy these days and many are being diagnosed who otherwise should not be.

His comments about environmental toxins are kinda bizarre.  Not that they are wrong, but that they, along with other things that he says, goes counter to what Trump and his Admin are currently doing.  But also, he hasn't been doing much himself to clean the air and water.  I am pretty sure that Trump only tapped him because of his anti-vaxx stance as it is a middle finger to Dr. Fauci.",crucial_geek,11,2025-04-14 20:23:35,deep state,0.11742424242424243,Nerd-19958
democrats,"RFK Jr. says Deep State ‘is real,’ called FDA employees ‘sock puppet’ of industry",78,An interesting 2019 view of the origin of the  [deep state concept.](https://www.thoughtco.com/deep-state-definition-4142030),HippyGrrrl,2,2025-04-14 20:23:35,deep state,0.25,Nerd-19958
democrats,"RFK Jr. says Deep State ‘is real,’ called FDA employees ‘sock puppet’ of industry",78,You're a Kennedy! You are rhe deep state!,Rosebunse,1,2025-04-14 20:23:35,deep state,0.0,Nerd-19958
democrats,"RFK Jr. says Deep State ‘is real,’ called FDA employees ‘sock puppet’ of industry",78,Trump could have addressed the “deep state” in his first term but didn’t because it doesn’t exist. Playing the victim card as usual,Kind-City-2173,1,2025-04-14 20:23:35,deep state,-0.018750000000000003,Nerd-19958
democrats,"RFK Jr. says Deep State ‘is real,’ called FDA employees ‘sock puppet’ of industry",78,"In some ways the ""deep state"" is similar to what was called ""The Establishment"" in the 1960s and 1970s, but from a different side of the political spectrum.",Nerd-19958,1,2025-04-14 20:23:35,deep state,0.0,HippyGrrrl
democrats,Was hard for me to find the list of people Kash Patel included in his book “Government Gangsters” as Deep State officials who need to be targeted so here it is in one place.,84,"damn, bro found the totally real ""deep state registry list""",sndtrb89,16,2024-12-02 14:25:37,deep state,0.0,Nice_Substance9123
democrats,Was hard for me to find the list of people Kash Patel included in his book “Government Gangsters” as Deep State officials who need to be targeted so here it is in one place.,84,"So Trump accidentally appointed over half of the Deep State to his first administration lmfao he's either one of them or absolutely powerless to them according to this logic. 

That's the problem with all of these ""conspiracy against Trump"" narratives from the impeachments to the 2020 election - in every one of their stories Trump is portrayed to be the weak and frail victim without any agency of his own, regardless of whether he's a private citizen or the fucking President. A strong leader wouldn't constantly be getting pushed around like this by the people he hires. 

They're always dancing around the fact that Trump had no clue what he's supposed to be doing for most of his time in office. It's always his hires undermining him or the Democrats persecuting him. All things he apparently couldn't overcome. He'll be just as ineffective as he was in his first term.",TheMemeStar24,2,2024-12-02 14:25:37,deep state,0.026190476190476184,Nice_Substance9123
democrats,Trump admits to election fraud?,1863,He made discussing election fraud taboo then used it to win?,dewlitz,30,2025-01-19 21:24:28,election fraud,0.8,LibrarySoggy3640
democrats,Trump admits to election fraud?,1863,I sure hope some deep state FBI agents are quietly looking into this...,ChiliDogYumZappupe,1,2025-01-19 21:24:28,election fraud,0.16666666666666666,LibrarySoggy3640
democrats,Trump admits to election fraud?,1863,"Ok, say he did steal the election. What does that make Biden and Kamala to you?

2.5 months to find any substance of possible election fraud, and they just decided to accept the results? I'd have a harder time believing that, unless they are just plain stupid. 

It would be great if there was any evidence to these theories, and by evidence, I don't count what a delusional demented rapist decides to say to his clown show of supporters.",TheOlNumber9,3,2025-01-19 21:24:28,election fraud,0.03095238095238097,ZenTrying
democrats,Trump admits to election fraud?,1863,the same election he literally was proven to committ election fraud in. aint it crazy.,SapToFiction,1,2025-01-19 21:24:28,election fraud,-0.3,Aardhart
democrats,Trump admits to election fraud?,1863,"If that happened, Would conservatives ever accept that he wasn't poisoned  by the deep state or some crazy ass shit?",RyeBourbonWheat,1,2025-01-19 21:24:28,election fraud,-0.26666666666666666,meatsmoothie82
democrats,Trump admits to election fraud?,1863,SCOTUS plus hundreds of Lower court judges and the fact that MAGA now controls every major social media outlet. The democratic party is dead- it’s going to take a long time for a new movement to claw back any semblance of control. (I purposely omitted all mention of corruption or election fraud enabled by the current unchecked power of MAGA) ,meatsmoothie82,1,2025-01-19 21:24:28,election fraud,-0.0025432900432900457,RyeBourbonWheat
democrats,"What happened to election fraud? Trump, GOP go quiet on claims after win",677,Its clear that all of the rubbish about election fraud is just another duplicitous tool wielded by the republican party and their foreign benefactors.,jpcapone,37,2024-11-10 14:57:28,election fraud,-0.01249999999999999,jpcapone
democrats,How can we help uncover election fraud?,358,As much as I would love there to be election fraud I just don't think there is anything to it.,bazilbt,-7,2025-02-01 08:57:40,election fraud,0.35,austinmo2
democrats,How can we help uncover election fraud?,358,I have been told the FBI is the Federal Organization that take care of election fraud…,SAGELADY65,0,2025-02-01 08:57:40,election fraud,0.0,austinmo2
democrats,How can we help uncover election fraud?,358,"Not appreciated by you? Don’t speak for everyone.

If there was concrete evidence of election fraud, Democratic leadership should have announced it after the results of the election, not after the inauguration of our next president. It should be their responsibility to fight and oppose cheaters, not leaving it up to internet sleuth conspiracy theorists.",19southmainco,0,2025-02-01 08:57:40,election fraud,0.016666666666666673,LilFaeryQueen
democrats,MAGA Lawmaker Now Under Investigation for Claiming Buffalo Shooting Was False Flag,469,MAGA was a false flag for being a patriot.,keaco,15,2022-05-17 13:04:04,false flag,-0.4000000000000001,Souled_Out
democrats,MAGA Lawmaker Now Under Investigation for Claiming Buffalo Shooting Was False Flag,469,"Its taking the phrase ""hot girl summer"" and using it to say that federal agents have started a false flag campaign this summer.

Roger's is trying to use a poplar phrase to emphasis the idea of government agents killing civilians to change public narrative.",matttech88,12,2022-05-17 13:04:04,false flag,-0.050000000000000024,ufo_senshi_diapolon
democrats,MAGA Lawmaker Now Under Investigation for Claiming Buffalo Shooting Was False Flag,469,"Okay, that makes sense. Thanks for the explanation. 

The ""false flag"" excuse is so easily debunked, yet it's trotted out by the MAGA base time after time.",ufo_senshi_diapolon,8,2022-05-17 13:04:04,false flag,-0.01944444444444447,matttech88
democrats,"Newsmax staffer suggests delta variant is false flag during White House press briefing, is very confused about how science works",19,"It’s a dumb question but nowhere did I read the reporter insinuate that delta is a false flag attack. It seems like he (Newsmax reporter) just doesn’t know that some of the samples are sent for genetic testing and that’s the data that the CDC uses to determine what the dominant strain is. It’s silly because that’s such an easily answerable question. My guess is that Karine Jean-Pierre was caught off guard with how basic a question it was. Newsmax guy is dumb, but he’s not calling it a false flag attack.

Full disclosure, I didn’t watch the video. I’m just going off the article, so if he said more stupidity in the video I can’t tell. It won’t load on my browser for some reason.",kbeks,1,2021-07-30 19:13:09,false flag,-0.12424242424242428,Reallynoreallyno
democrats,CNN to Trump: You incited this,1489,"Numerous pipe bombs have been sent to leaders of the Democratic Party and vocal critics of the President. The Obamas, Clintons, Joe Biden, Kamala Harris, Maxine Waters, George Soros, Robert De Niro, and John Brennan (care of CNN) were all the targets of a attempted assassination. This list easily reads as a political hit list of the President’s favorite enemies, a President that celebrates violence and encourages the hateful rhetoric of modern politics. While many politicians in the past have played on our differences, dividing Americans, Trump has enflamed those divisions for political gain.

During campaign rallies, he routinely encouraged violence against protestors - even offering to pay the legal fees (he didn’t end up paying). Trump “joked” about 2nd Amendment solutions should Clinton win After the election, he defended the white supremacists in Charlottesville that not only beat counter protestors with sticks, bats and shields but also murdered a woman by driving a car into the crowd. During these midterm rallies, he has attacked Democrats an a angry mob that will use violence if they win back Congress (which makes no sense whatsoever, but that’s who he is). He still leads chants of lock her up, though exactly who and for what isn’t exactly clear other than political opponents (Ted Cruz also got into this by saying that his opponent Beto O’Rourke should be jailed, I guess for running against him). And just last week he celebrated a Republican representative that plead guilty to assaulting a reporter that simply asked the candidate their position on repealing the ACA. Celebrated him as an American journalist was murdered by the Saudis (who only made the Saudi enemies list when he criticized Trump). As he calls the press the enemy of the people, encouraging despots around the world to imprison and murder journalists without American retribution.

I am clearly not saying that Trump built and sent these bombs. That is the fault entirely of the bomber. But this political environment is entirely the fault of President Trump. Well, Trump and the people that support him. It is no coincidence that racists chant Trump’s name as a they harass people of a darker hue as it elicits a strong feeling of pride in the white supremacists amongst us. And I don’t just mean the frothing MAGA-hat-wearers who cheered on his celebrations of violence in real time. Republican politicians either completely ignored or mildly rebuked his rhetoric while completely caved to his hate to win an election. It’s also the fault of all of those that voted for him. You had a chance to show him and other hate mongers, that incitement of political violence remains unacceptable in America and you failed spectacularly. He faced no electoral punishment for his behaviors and you rewarded with an unexpected victory.

Yesterday, as events unfolded, the President meekly read from a statement prepared by his staff. He did not stand with the former Presidents that had been targeted. But he read, the absolute minimal statement he needed to. And that lasted for less than a day. As political opponents received more packages, he went back to the campaign trail. While he did not aggressively attack as he normally did, he did demonstrate that he doesn’t care. He mocked the idea of his own statement- saying he can be good for awhile. Then this morning he attacked the mainstream media for this situation. Because reporting on Trump’s hateful rhetoric is their fault, for repeating his words and actions. The Press Secretary (who no longer holds daily press briefings) said that it was CNN’s fault for receiving a bomb at their office.

Trump and the Republicans will not unify the country. The entire Republican platform is about fear and hate. They want to encourage the haters to get out to vote. Those that hate blacks, hate Hispanics, hate Muslims, hate immigrants, hate gays, hate trans people, hate liberals and so on. They have always done this. But now their leader actively encourages the violence that follows. Hate crimes surged in 2017 against Jews and Muslims as the White House said nothing. White supremacists feel entitled to march in the streets, even starting a brawl last week in NYC. The President says nothing, and in fact purposefully describes himself as a nationalist (exactly what those people want).

The President and his party will not change. But we can change them. We are a week away from the end of the midterm election - voting is going on right now. You can vote to support the hate and violence further emboldening Trump. Or you can condemn it by voting for the Democrats. I think the choice is simple. We are all Americans. We are not enemies. We may be opponents for sure, but we are not enemies. And we should not reward the political party that doesn't seem to understand this.",deaconheel,9,2018-10-25 07:39:33,false flag,-0.025334821428571408,progress18
democrats,CNN to Trump: You incited this,1489,"Because the shooting is the shooting, it’s clearly politically motivated so that’s one. Gabby Giffords, the pizza gate guy, every abortion clinic bombing/shooting, George Tiller, Charlottesville, Oklahoma City, etc. etc. No one can deny these incidents but looking up the voter registration when the motive is clearly just two cunts that got into it over neighborhood bullshit is a false equivalency. ",greenflash1775,7,2018-10-25 07:39:33,false flag,-0.10000000000000002,memultipletimes
democrats,CNN to Trump: You incited this,1489,"Oh, you have a 'friend' that is an explosives expert! I see, so he's involved in the investigation? How else did he get access to these devices, how does he know so much about the inner workings of the investigation? It's almost as though you are completely full of shit

I can't find any sources that say the bombs can't be detonated. I did see that there was an ISIS sticker on one and some of the names were incorrectly spelled on the addresses. The bomb material is real, as is the detonator.

None of them went off, which would suggests to me an amateur built the bombs and was dumb enough to think a sticker would throw off the investigation in case one of them was intercepted. That's complete conjecture, but it comes from my friend who is a counter terrorism expert and former CIA director so take it for what it is (/s).

Seriously, where did you see this 'numerous debunking'? r/The_Donald? Youtube? The proud boys facebook page? Did another one of your 'friends' tell you this?

Obama was sent ricin, twice. Were those false flag operations as well?

Edit: The AP reports the man charged with the crime is a MAGA hat wearing, Alt-Right troll with an extensive criminal record and a van covered in anti liberal propaganda and conspiracy theories.",chuc16,1,2018-10-25 07:39:33,false flag,-0.024019607843137253,kekistanipoland
democrats,"""This fully weaponized Monster, Jack Smith"" 🙃",628,"Are you kidding me? This is all a pelart if his agenda.  He is doing this to continue his fight against the cabal.  He will let them all see, when the public executions of democrats and Hollywood elites start.  /s

Source: my dad.",Smelly-taint,25,2022-11-28 19:39:36,cabal,0.0,wangchungafternoon
democrats,"""This fully weaponized Monster, Jack Smith"" 🙃",628,The cabal is tired.,PubicGalaxies,3,2022-11-28 19:39:36,cabal,-0.4,Smelly-taint
democrats,morning in MAGAville,190,"Couldn’t resist adding part of “the deep state” article from the Blaze- of course it was about Hillary, Harris, Biden being relieved of security clearances.

The silos of MAGAville are insulated from reality. I can’t speak for everyone here, but my go to sources are typically NPR, BBC, AP, Reuters, Telegraph, The Guardian, the bulwark, WSJ, a range of sources in the EU (DeutschWorld, France24 etc). Once in a while I may hit the usual suspects on the networks. 

The viewers of these NetWrecks are clearly being spoonfed star spangled trump pap.",mole_that_got_whackd,36,2025-03-27 11:02:22,new world order,-0.07916666666666665,mole_that_got_whackd
democrats,"It's becoming clear the rest of my life, and probably the rest of my toddler's life, this is how it'll be. Every time democrats win, it's instantly a stolen election.",599,"For what it may be worth, the 'elections are rigged / stolen"" narrative is not new and goes back decades.

The only difference is that it used to be something from the far-left back in the day.

But, this idea that the only way Dems can take back at least the House is through 'sketchy stuff' is pure nonsense.  Here is the thing -- this group of people have a term for it, 'Trump Degrangment Syndrome', this group of people believe that there is an entire swatch of society who are brainwashed by the left wing MSM machine, billionaires, etc., and of course the regular old run of the mill Dems, and so on .... that there is not enough of them to actually, legit, vote in Dems?  I mean, they believe they are the handful of selected soldiers who are tasked with defending Trump at all costs, and by their own estimates should be outnumbered, but ... if they lose then it is only because of stolen elections?",crucial_geek,1,2025-03-27 18:12:15,stolen election,0.02964466089466089,unfinishedtoast3
democrats,"It's becoming clear the rest of my life, and probably the rest of my toddler's life, this is how it'll be. Every time democrats win, it's instantly a stolen election.",599,"Don't worry.....every time a republican wins, the GOP will also claim its a stolen election.",Numerous_Photograph9,1,2025-03-27 18:12:15,stolen election,0.3,unfinishedtoast3
democrats,Who knew Pizzagate was actually in Mar-A-Lago?,2021,We should have known the party of projection claiming Qanon meant that they themselves were the perpetrators.,production-values,3,2021-05-23 11:11:47,pizzagate,0.0,raistlin65
democrats,Who knew Pizzagate was actually in Mar-A-Lago?,2021,QAnon knew. That's why they tried so damn hard to deflect,NeighborhoodVeteran,2,2021-05-23 11:11:47,pizzagate,-0.2916666666666667,raistlin65
democrats,Who knew Pizzagate was actually in Mar-A-Lago?,2021,"What weirds me out, is my friend was talking about pizzagate and all this stuff since 2015 and I would call him a conspiracy theorist.. Now I listen to everything he talks about.",AcanthocephalaOk9507,1,2021-05-23 11:11:47,pizzagate,0.0,raistlin65
democrats,Stop letting them get away with it.,1649,Pizzagate!,floofnstuff,3,2024-12-10 22:45:58,pizzagate,0.0,1Rab
democrats,Pizzagate is a lie. But what it says about our society is real. Americans who believe fake news aren’t duped - they willingly decide to accept whatever outrageous story fits their bias and hatred | Ijeoma Oluo,218,"Genuinely asking, why is pizzagate a hoax? ",alexgduarte,3,2016-12-06 06:48:18,pizzagate,0.4,AonghusMacKilkenny
